<?xml version="1.0" encoding="UTF-8"?><!DOCTYPE definition SYSTEM "dtdice.dtd"><definition><abstr id="abstract">  <keywords>  <Keyword>arythmetique</Keyword>   <Keyword>division</Keyword>  <Keyword>addition</Keyword>  <Keyword>calcul</Keyword>   <Keyword>mathematique</Keyword>  <Keyword>/</Keyword> </keywords>      <types>     <complexType name="div">           <element name="A" type="int"/>           <element name="B" type="int"/>                      </complexType>            </types>  <message name="entree">    <part name="in" type="int"/>        <part name="in2" type="int"/>      </message> <message name="entree3">    <part name="in" type="int"/>        <part name="in2" type="int"/>  </message>   <message name="sortie">    <part name="out" type="int"/>        <part name="out2" type="int"/>      </message>  <message name="sortie3">    <part name="out" type="int"/>        <part name="out2" type="int"/>  </message>    <operations name="Arythmetique">    <operation name="Division">     <input message="entree"/>     <output message="sortie"/>    <conditions>    <Precondition name="div_zero" > tricou dpou </Precondition>    <Postcondition name="post1" > une poste condition 1  </Postcondition>    <Postcondition name="post11" > une poste condition 11  </Postcondition>            <Postcondition name="post13" > une poste condition 3  </Postcondition>        </conditions>        </operation>            <operation name="Addition">     <input message="entree3"/>     <output message="sortie3"/>    <conditions>    <Postcondition name="post1" > une poste condition 1  </Postcondition>    <Postcondition name="post11" > une poste condition 11  </Postcondition>        </conditions>        </operation>         </operations></abstr> <concret id="concret"><liaison name="binding_arythmetique" type="Arythmetique">  <titre>Mathematique</titre>     <application> Calculatrice </application>    <operationC name="division" type="Function" >      <titre >division() </titre>       <nligne>        <debut> 145 </debut>        <fin> 161 </fin>      </nligne>    </operationC>    <operationC name="Addition" type="Function" >      <titre >Addition() </titre>       <nligne>        <debut> 164 </debut>        <fin> 186 </fin>      </nligne>    </operationC>  </liaison></concret></definition>