<?xml version="1.0" encoding="UTF-8"?><!DOCTYPE definition SYSTEM "dtdice.dtd"><definition>  <abstr id="abstract">    <keywords>  <Keyword>arythmetique</Keyword>   <Keyword>soustraction</Keyword>  <Keyword>addition</Keyword>  <Keyword>calcul</Keyword>   <Keyword>mathematiqu-</Keyword>  <Keyword>-</Keyword>  <Keyword>+</Keyword> </keywords>      <types>     <complexType name="Comp">           <element name="A" type="int"/>           <element name="B" type="int"/>                      </complexType>            </types>  <message name="entree3">    <part name="in" type="int"/>        <part name="in2" type="int"/>      </message> <message name="entree4">    <part name="in_devision" type="double"/>        <part name="in_devision2" type="double"/>      </message>   <message name="sortie3">    <part name="out" type="int"/>        <part name="out2" type="int"/>      </message>  <message name="sortie4">    <part name="outtestetion" type="double"/>        <part name="out2testation" type="float"/>      </message>    <portType name="Arythmetique">    <operation name="Addition">     <input message="entree3"/>     <output message="sortie3"/>    <conditions>    <Postcondition name="post1" > une poste condition 1  </Postcondition>    <Postcondition name="post11" > une poste condition 11  </Postcondition>        </conditions>        </operation>        <operation name="Soustraction">     <input message="entree4"/>     <output message="sortie4"/>    <conditions> <Postcondition name="post6" > une poste condition 2  </Postcondition>    </conditions>        </operation>         </portType></abstr> <concret id="concret"><liaison name="binding_arythmetique" type="Arythmetique">  <titre>Mathematique</titre>     <application> Calculatrice </application>    <operationC name="Soustraction" type="Function" >      <titre >soustraction() </titre>       <nligne>        <debut> 145 </debut>        <fin> 161 </fin>      </nligne>    </operationC>    <operationC name="Addition" type="Function" >      <titre >Addition() </titre>       <nligne>        <debut> 164 </debut>        <fin> 186 </fin>      </nligne>    </operationC>  </liaison></concret></definition>